{
  "$schema": "../../../packages/schemas/lab-manifest.schema.json",
  "id": "durable-event-pipeline",
  "title": "Durable usage pipeline, checkpoint recovery and consumer lag",
  "domain": "data-engineering",
  "runtime": "process",
  "difficulty": "intermediate",
  "commands": {"start": "run.py start", "test": "run.py test", "reset": "run.py reset"},
  "resources": {"cpu": "0.5", "memory": "96Mi"},
  "safety": {"internet_access_required": false, "vulnerable_target": false},
  "telemetry": {"logs": true, "metrics": true, "traces": false}
}
