{
  "$schema": "../../../packages/schemas/lab-manifest.schema.json",
  "id": "database-query-plans",
  "title": "Tenant query-plan and composite-index lab",
  "domain": "databases",
  "runtime": "process",
  "difficulty": "intermediate",
  "commands": {
    "start": "run.py start",
    "test": "run.py test",
    "benchmark": "run.py benchmark",
    "reset": "run.py reset",
    "verify": "run.py verify"
  },
  "resources": { "cpu": "0.5", "memory": "128Mi" },
  "safety": { "internet_access_required": false, "vulnerable_target": false },
  "telemetry": { "logs": true, "metrics": true, "traces": false }
}

