{
  "id": "framework-comparison",
  "title": "PyTorch and TensorFlow/Keras comparison",
  "domain": "deep-learning",
  "runtime": "process",
  "difficulty": "advanced",
  "commands": {
    "start": "python labs/deep-learning/framework-comparison/run.py start",
    "test": "python labs/deep-learning/framework-comparison/run.py test",
    "reset": "python labs/deep-learning/framework-comparison/run.py reset"
  },
  "safety": {
    "internet_access_required": false,
    "vulnerable_target": false
  },
  "resources": {
    "cpu": "1",
    "memory": "2Gi"
  },
  "telemetry": {
    "logs": true,
    "metrics": true,
    "traces": false
  }
}
