{
  "id": "model-evaluation",
  "title": "Model workflow, evaluation, and interpretation",
  "domain": "machine-learning",
  "runtime": "process",
  "difficulty": "advanced",
  "commands": {
    "start": "python labs/ml/model-evaluation/run.py start",
    "test": "python labs/ml/model-evaluation/run.py test",
    "reset": "python labs/ml/model-evaluation/run.py reset"
  },
  "safety": {"internet_access_required": false, "vulnerable_target": false},
  "resources": {"cpu": "2", "memory": "512Mi"},
  "telemetry": {"logs": true, "metrics": true, "traces": false}
}
