{
  "$schema": "../../../packages/schemas/lab-manifest.schema.json",
  "id": "database-isolation-locks",
  "title": "SQLite reader-snapshot and writer-lock lab",
  "domain": "databases",
  "runtime": "process",
  "difficulty": "advanced",
  "commands": {
    "start": "run.py start",
    "test": "run.py test",
    "reset": "run.py reset",
    "verify": "run.py verify"
  },
  "resources": { "cpu": "0.25", "memory": "64Mi" },
  "safety": { "internet_access_required": false, "vulnerable_target": false },
  "telemetry": { "logs": true, "metrics": false, "traces": false }
}
