{
  "id": "data-science-quality",
  "title": "Operational dataset quality and scaling",
  "domain": "data",
  "runtime": "process",
  "difficulty": "advanced",
  "commands": {
    "start": "python labs/data/science-quality/run.py start",
    "test": "python labs/data/science-quality/run.py test",
    "reset": "python labs/data/science-quality/run.py reset"
  },
  "safety": {"internet_access_required": false, "vulnerable_target": false},
  "resources": {"cpu": "2", "memory": "512Mi"},
  "telemetry": {"logs": true, "metrics": true, "traces": false}
}
