{
  "$schema": "../../../packages/schemas/lab-manifest.schema.json",
  "id": "agent-security-boundaries", "title": "Agent memory poisoning and separate approvals",
  "domain": "security", "runtime": "process", "difficulty": "advanced",
  "commands": {"start": "run.py start", "test": "run.py test", "reset": "run.py reset", "verify": "run.py verify"},
  "resources": {"cpu": "0.5", "memory": "128Mi"},
  "safety": {"internet_access_required": false, "vulnerable_target": false},
  "telemetry": {"logs": true, "metrics": false, "traces": false}
}
